{
  "$schema": "https://json-schema.org/draft/2020-12/schema",
  "$id": "https://example.local/schemas/lorebook.schema.json",
  "title": "LoreBook Schema",
  "type": "object",
  "required": ["id", "name", "enabled", "budget", "entries"],
  "additionalProperties": false,
  "properties": {
    "id": { "type": "string", "minLength": 1 },
    "name": { "type": "string", "minLength": 1 },
    "enabled": { "type": "boolean" },
    "description": { "type": "string" },
    "source_scope": {
      "type": "array",
      "items": { "type": "string", "enum": ["global", "character", "persona", "chat"] },
      "uniqueItems": true
    },
    "merge_policy": {
      "type": "object",
      "additionalProperties": false,
      "properties": {
        "mode": { "type": "string", "enum": ["global_sorted_merge", "character_first"] },
        "priority": {
          "type": "array",
          "items": { "type": "string", "enum": ["global", "character", "persona", "chat"] },
          "uniqueItems": true
        }
      },
      "required": ["mode", "priority"]
    },
    "budget": {
      "type": "object",
      "required": ["max_tokens", "overflow_policy"],
      "additionalProperties": false,
      "properties": {
        "max_tokens": { "type": "integer", "minimum": 1 },
        "overflow_policy": { "type": "string", "enum": ["drop_low_priority", "truncate_tail", "truncate_head"] }
      }
    },
    "runtime": {
      "type": "object",
      "additionalProperties": false,
      "properties": {
        "max_recursion_steps": { "type": "integer", "minimum": 0 },
        "random_seed_strategy": { "type": "string", "enum": ["session_stable", "request_random"] },
        "log_level": { "type": "string", "enum": ["off", "normal", "debug"] }
      },
      "required": ["max_recursion_steps", "random_seed_strategy", "log_level"]
    },
    "entries": {
      "type": "array",
      "items": { "$ref": "#/$defs/entry" },
      "minItems": 1
    }
  },
  "$defs": {
    "triggers": {
      "type": "object",
      "required": ["keywords", "regex", "case_sensitive", "whole_word"],
      "additionalProperties": false,
      "properties": {
        "keywords": { "type": "array", "items": { "type": "string" } },
        "regex": { "type": "array", "items": { "type": "string" } },
        "case_sensitive": { "type": "boolean" },
        "whole_word": { "type": "boolean" }
      }
    },
    "filters": {
      "type": "object",
      "additionalProperties": false,
      "properties": {}
    },
    "injection": {
      "allOf": [
        {
          "type": "object",
          "required": ["position_type", "order", "message_type", "depth"],
          "additionalProperties": false,
          "properties": {
            "position_type": {
              "type": "string",
              "enum": [
                "before_core",
                "after_core",
                "before_character",
                "after_character",
                "before_persona",
                "after_persona",
                "depth"
              ]
            },
            "order": { "type": "integer" },
            "message_type": {
              "oneOf": [
                { "type": "null" },
                { "type": "string", "enum": ["system", "user", "assistant"] }
              ]
            },
            "depth": {
              "oneOf": [
                { "type": "null" },
                { "type": "integer", "minimum": 0 }
              ]
            }
          }
        },
        {
          "if": {
            "properties": { "position_type": { "const": "depth" } },
            "required": ["position_type"]
          },
          "then": {
            "properties": {
              "depth": { "type": "integer", "minimum": 0 }
            },
            "required": ["depth"]
          },
          "else": {
            "properties": {
              "depth": { "type": "null" }
            }
          }
        }
      ]
    },
    "advanced": {
      "type": "object",
      "required": ["inclusion_group", "group_scoring", "probability", "recursive", "max_recursion_depth", "sticky_turns", "cooldown_turns", "delay_turns"],
      "additionalProperties": false,
      "properties": {
        "inclusion_group": { "type": ["string", "null"] },
        "group_scoring": { "type": "boolean" },
        "probability": { "type": "number", "minimum": 0, "maximum": 1 },
        "recursive": { "type": "boolean" },
        "max_recursion_depth": { "type": "integer", "minimum": 0 },
        "sticky_turns": { "type": "integer", "minimum": 0 },
        "cooldown_turns": { "type": "integer", "minimum": 0 },
        "delay_turns": { "type": "integer", "minimum": 0 }
      }
    },
    "entryBudget": {
      "type": "object",
      "required": ["max_tokens", "truncate"],
      "additionalProperties": false,
      "properties": {
        "max_tokens": { "type": "integer", "minimum": 1 },
        "truncate": { "type": "string", "enum": ["head", "tail", "none"] }
      }
    },
    "resolved": {
      "type": "object",
      "required": ["triggers", "filters", "injection", "advanced", "budget"],
      "additionalProperties": false,
      "properties": {
        "triggers": { "$ref": "#/$defs/triggers" },
        "filters": { "$ref": "#/$defs/filters" },
        "injection": { "$ref": "#/$defs/injection" },
        "advanced": { "$ref": "#/$defs/advanced" },
        "budget": { "$ref": "#/$defs/entryBudget" }
      }
    },
    "entry": {
      "type": "object",
      "required": ["id", "path", "enabled", "content", "resolved"],
      "additionalProperties": false,
      "properties": {
        "id": { "type": "string", "pattern": "^[a-z0-9]+(?:-[a-z0-9]+)*$" },
        "path": { "type": "string", "pattern": "^entries/.+\\.md$" },
        "enabled": { "type": "boolean" },
        "content": { "type": "string", "minLength": 1 },
        "resolved": { "$ref": "#/$defs/resolved" }
      }
    }
  }
}
